{
  "schema_version": "1.0",
  "generated_for": "v0.12.0 Product Passport Bridge — source inventory",
  "prototype_note": "Prototype/reference only. Not official GS1 or DPP production data. Sources listed here are public reference documents gathered for structural analysis only.",
  "sources": [
    {
      "source_id": "dpp_core_context_jsonld",
      "title": "Digital Product Passport Core JSON-LD Context (EPCIS/GS1 aligned, reference)",
      "source_url": "PASTE_PUBLIC_SOURCE_URL_HERE",
      "source_type": "context",
      "version": "PLACEHOLDER",
      "sector": "core",
      "local_path": "product_passport/reference_sources/raw_public/contexts/dpp_core_context.jsonld",
      "sha256": "PLACEHOLDER_SHA256_AFTER_DOWNLOAD",
      "retrieved_at": "PLACEHOLDER",
      "public_accessible": null,
      "license_or_rights_note": "Review the source URL for license terms before use.",
      "proof_of_concept_note": "Placeholder entry. Download the context file and update sha256, retrieved_at, and source_url with actual values.",
      "usage_note": "Reference JSON-LD context for Product Passport data modelling. Used for structural analysis only.",
      "used_by": ["product_passport_bridge_v0.12.0"],
      "normalized_output": null
    },
    {
      "source_id": "dpp_general_product_schema",
      "title": "Digital Product Passport — General Product JSON Schema (reference)",
      "source_url": "PASTE_PUBLIC_SOURCE_URL_HERE",
      "source_type": "json_schema",
      "version": "PLACEHOLDER",
      "sector": "general_product",
      "local_path": "product_passport/reference_sources/raw_public/schemas/dpp_general_product.schema.json",
      "sha256": "PLACEHOLDER_SHA256_AFTER_DOWNLOAD",
      "retrieved_at": "PLACEHOLDER",
      "public_accessible": null,
      "license_or_rights_note": "Review the source URL for license terms before use.",
      "proof_of_concept_note": "Placeholder entry. Download the schema file and update sha256, retrieved_at, and source_url with actual values.",
      "usage_note": "General product DPP JSON Schema for structural validation. Prototype/reference only.",
      "used_by": ["product_passport_bridge_v0.12.0"],
      "normalized_output": null
    },
    {
      "source_id": "dpp_battery_schema",
      "title": "Battery Digital Product Passport JSON Schema (EU Battery Regulation reference)",
      "source_url": "PASTE_PUBLIC_SOURCE_URL_HERE",
      "source_type": "json_schema",
      "version": "PLACEHOLDER",
      "sector": "battery",
      "local_path": "product_passport/reference_sources/raw_public/schemas/dpp_battery.schema.json",
      "sha256": "PLACEHOLDER_SHA256_AFTER_DOWNLOAD",
      "retrieved_at": "PLACEHOLDER",
      "public_accessible": null,
      "license_or_rights_note": "Review the source URL for license terms before use.",
      "proof_of_concept_note": "Placeholder entry. Download the schema file and update sha256, retrieved_at, and source_url with actual values.",
      "usage_note": "Battery sector DPP JSON Schema for structural validation. Prototype/reference only.",
      "used_by": ["product_passport_bridge_v0.12.0"],
      "normalized_output": null
    },
    {
      "source_id": "dpp_textile_schema",
      "title": "Textile Digital Product Passport JSON Schema (EU Textile Regulation reference)",
      "source_url": "PASTE_PUBLIC_SOURCE_URL_HERE",
      "source_type": "json_schema",
      "version": "PLACEHOLDER",
      "sector": "textile",
      "local_path": "product_passport/reference_sources/raw_public/schemas/dpp_textile.schema.json",
      "sha256": "PLACEHOLDER_SHA256_AFTER_DOWNLOAD",
      "retrieved_at": "PLACEHOLDER",
      "public_accessible": null,
      "license_or_rights_note": "Review the source URL for license terms before use.",
      "proof_of_concept_note": "Placeholder entry. Download the schema file and update sha256, retrieved_at, and source_url with actual values.",
      "usage_note": "Textile sector DPP JSON Schema for structural validation. Prototype/reference only.",
      "used_by": ["product_passport_bridge_v0.12.0"],
      "normalized_output": null
    },
    {
      "source_id": "dpp_core_shacl_shapes",
      "title": "Digital Product Passport Core SHACL Shapes (reference)",
      "source_url": "PASTE_PUBLIC_SOURCE_URL_HERE",
      "source_type": "shacl_shape",
      "version": "PLACEHOLDER",
      "sector": "core",
      "local_path": "product_passport/reference_sources/raw_public/shacl/dpp_core.shacl.ttl",
      "sha256": "PLACEHOLDER_SHA256_AFTER_DOWNLOAD",
      "retrieved_at": "PLACEHOLDER",
      "public_accessible": null,
      "license_or_rights_note": "Review the source URL for license terms before use.",
      "proof_of_concept_note": "Placeholder entry. Download the SHACL file and update sha256, retrieved_at, and source_url with actual values. SHACL execution is NOT performed in v0.12.0 — shapes are inventoried only.",
      "usage_note": "SHACL shapes for DPP structural constraints. Inventoried only in v0.12.0. No SHACL execution is performed.",
      "used_by": ["product_passport_bridge_v0.12.0"],
      "normalized_output": null
    },
    {
      "source_id": "dpp_minimal_example",
      "title": "Minimal Digital Product Passport JSON-LD Example (prototype/reference)",
      "source_url": "PLACEHOLDER",
      "source_type": "example",
      "version": "v0.12.0-prototype",
      "sector": "core",
      "local_path": "product_passport/examples/minimal_product_passport.json",
      "sha256": "PLACEHOLDER_SHA256_AFTER_DOWNLOAD",
      "retrieved_at": "2026-06-30",
      "public_accessible": true,
      "license_or_rights_note": "Prototype example created for this project. Not official GS1 or DPP production data.",
      "proof_of_concept_note": "Minimal example for testing structural validation. Prototype/reference only.",
      "usage_note": "Minimal DPP-like JSON-LD prototype for testing the Schema Validator workflow.",
      "used_by": ["product_passport_bridge_v0.12.0"],
      "normalized_output": null
    },
    {
      "source_id": "dpp_epcis_example",
      "title": "EPCIS Product Passport Event Example (reference structure)",
      "source_url": "PASTE_PUBLIC_SOURCE_URL_HERE",
      "source_type": "epcis_example",
      "version": "PLACEHOLDER",
      "sector": "epcis",
      "local_path": "product_passport/reference_sources/raw_public/examples/dpp_epcis_event_example.json",
      "sha256": "PLACEHOLDER_SHA256_AFTER_DOWNLOAD",
      "retrieved_at": "PLACEHOLDER",
      "public_accessible": null,
      "license_or_rights_note": "Review the source URL for license terms before use.",
      "proof_of_concept_note": "Placeholder entry. Download the example file and update sha256, retrieved_at, and source_url with actual values.",
      "usage_note": "EPCIS-based DPP event example for structural reference. Prototype/reference only.",
      "used_by": ["product_passport_bridge_v0.12.0"],
      "normalized_output": null
    }
  ]
}
